{
  "schema_version": 1,
  "manifest_id": "benchmark/families-v1/slice-30-assets",
  "status": "classified_local_only",
  "source_revision": "a2dde2b191f6b78c2003d74875560da782470968",
  "language_version": "0.43",
  "closure_manifest_id": "benchmark/families-v1/slice-30-closure",
  "closure_policy": "whole_program_build_input",
  "classification": {
    "sensitivity": "internal",
    "use_scope": "local_training_and_evaluation_only",
    "external_distribution": "prohibited_pending_O009",
    "authorization_basis": "user_explicit_local_training_mandate_2026-08-20",
    "legal_review": "not_performed"
  },
  "classification_id": "internal_local_training_only_pending_O009",
  "counts": {
    "assets_in": 201,
    "assets_out": 201,
    "asset_paths_distinct": 201,
    "asset_blob_oids_distinct": 201,
    "gaps": 0
  },
  "assets": [
    {"path":"examples/play-prod-v2/_tenant.metis","blob_oid":"d38b2f1e53de5231f1d0dfdfccb075b893d5ecc2","sensitivity":"internal","use_scope":"local_training_and_evaluation_only","external_distribution":"prohibited_pending_O009","authorization_basis":"user_explicit_local_training_mandate_2026-08-20","legal_review":"not_performed"},
    {"path":"examples/play-prod-v2/catalogs/link.metis","blob_oid":"918c7ef3f3215fa834a6b25fe9e65f790a76969d","sensitivity":"internal","use_scope":"local_training_and_evaluation_only","external_distribution":"prohibited_pending_O009","authorization_basis":"user_explicit_local_training_mandate_2026-08-20","legal_review":"not_performed"},
    {"path":"examples/play-prod-v2/catalogs/smart_index.metis","blob_oid":"053125493a64d16ae175616860b0777a10e29fc5","sensitivity":"internal","use_scope":"local_training_and_evaluation_only","external_distribution":"prohibited_pending_O009","authorization_basis":"user_explicit_local_training_mandate_2026-08-20","legal_review":"not_performed"},
    {"path":"examples/play-prod-v2/catalogs/trending.metis","blob_oid":"e4b2f7d940cc19b4f7e6656d3ef91d81f26d2286","sensitivity":"internal","use_scope":"local_training_and_evaluation_only","external_distribution":"prohibited_pending_O009","authorization_basis":"user_explicit_local_training_mandate_2026-08-20","legal_review":"not_performed"},
    {"path":"examples/play-prod-v2/catalogs/user_clusters.metis","blob_oid":"084833c59deb28bea70e679a4e1b65ad2078b3a9","sensitivity":"internal","use_scope":"local_training_and_evaluation_only","external_distribution":"prohibited_pending_O009","authorization_basis":"user_explicit_local_training_mandate_2026-08-20","legal_review":"not_performed"},
    {"path":"examples/play-prod-v2/catalogs/user_session.metis","blob_oid":"e34e73f7fcaecbe2919ffc5dd06956690c8f7c41","sensitivity":"internal","use_scope":"local_training_and_evaluation_only","external_distribution":"prohibited_pending_O009","authorization_basis":"user_explicit_local_training_mandate_2026-08-20","legal_review":"not_performed"},
    {"path":"examples/play-prod-v2/catalogs/users.metis","blob_oid":"72a645f3dbc5eba67e0794923edea71e10d1badb","sensitivity":"internal","use_scope":"local_training_and_evaluation_only","external_distribution":"prohibited_pending_O009","authorization_basis":"user_explicit_local_training_mandate_2026-08-20","legal_review":"not_performed"},
    {"path":"examples/play-prod-v2/catalogs/video.metis","blob_oid":"6c1c200c8297ff4a695854e238554c0882d1c4f7","sensitivity":"internal","use_scope":"local_training_and_evaluation_only","external_distribution":"prohibited_pending_O009","authorization_basis":"user_explicit_local_training_mandate_2026-08-20","legal_review":"not_performed"},
    {"path":"examples/play-prod-v2/legacy-wire.json","blob_oid":"422e6209514e43bbe786320b80bb0985afa9efad","sensitivity":"internal","use_scope":"local_training_and_evaluation_only","external_distribution":"prohibited_pending_O009","authorization_basis":"user_explicit_local_training_mandate_2026-08-20","legal_review":"not_performed"},
    {"path":"examples/play-prod-v2/lib/lists.metis","blob_oid":"1156ae317e53003214bf69cb41f8d28bb4ce61b3","sensitivity":"internal","use_scope":"local_training_and_evaluation_only","external_distribution":"prohibited_pending_O009","authorization_basis":"user_explicit_local_training_mandate_2026-08-20","legal_review":"not_performed"},
    {"path":"examples/play-prod-v2/lib/presets.metis","blob_oid":"348df13b9511473e1a2d755eca222c09cf13eba6","sensitivity":"internal","use_scope":"local_training_and_evaluation_only","external_distribution":"prohibited_pending_O009","authorization_basis":"user_explicit_local_training_mandate_2026-08-20","legal_review":"not_performed"},
    {"path":"examples/play-prod-v2/lib/presets.migrated.metis","blob_oid":"cbae5ea0b0908f1d5f2c8bd3b7e3750834825719","sensitivity":"internal","use_scope":"local_training_and_evaluation_only","external_distribution":"prohibited_pending_O009","authorization_basis":"user_explicit_local_training_mandate_2026-08-20","legal_review":"not_performed"},
    {"path":"examples/play-prod-v2/materialized-fallbacks.source.json","blob_oid":"9afb2576a0f15df139b69612a73cc2764a3a104e","sensitivity":"internal","use_scope":"local_training_and_evaluation_only","external_distribution":"prohibited_pending_O009","authorization_basis":"user_explicit_local_training_mandate_2026-08-20","legal_review":"not_performed"},
    {"path":"examples/play-prod-v2/metis.toml","blob_oid":"47642ed641dcf60f6b64fda604c721f349a582bf","sensitivity":"internal","use_scope":"local_training_and_evaluation_only","external_distribution":"prohibited_pending_O009","authorization_basis":"user_explicit_local_training_mandate_2026-08-20","legal_review":"not_performed"},
    {"path":"examples/play-prod-v2/names.map.json","blob_oid":"985caca26b87e99cf5c08b1050d884761f3bc77d","sensitivity":"internal","use_scope":"local_training_and_evaluation_only","external_distribution":"prohibited_pending_O009","authorization_basis":"user_explicit_local_training_mandate_2026-08-20","legal_review":"not_performed"},
    {"path":"examples/play-prod-v2/properties/dem/_property.metis","blob_oid":"0c1173e58bfaceae6620d8a3b8fdaab299bfbec4","sensitivity":"internal","use_scope":"local_training_and_evaluation_only","external_distribution":"prohibited_pending_O009","authorization_basis":"user_explicit_local_training_mandate_2026-08-20","legal_review":"not_performed"},
    {"path":"examples/play-prod-v2/properties/dem/dem_test.metis","blob_oid":"1b27f647d272affaaa94a16bddf2e09019c7a5b4","sensitivity":"internal","use_scope":"local_training_and_evaluation_only","external_distribution":"prohibited_pending_O009","authorization_basis":"user_explicit_local_training_mandate_2026-08-20","legal_review":"not_performed"},
    {"path":"examples/play-prod-v2/properties/general/_property.migrated.metis","blob_oid":"c2d42d1e2927f308e56a82a089ffedeba80e32cf","sensitivity":"internal","use_scope":"local_training_and_evaluation_only","external_distribution":"prohibited_pending_O009","authorization_basis":"user_explicit_local_training_mandate_2026-08-20","legal_review":"not_performed"},
    {"path":"examples/play-prod-v2/properties/general/prod_codice_f_presente.metis","blob_oid":"68fa18739b9cb6896307c73837fa65bb670c191d","sensitivity":"internal","use_scope":"local_training_and_evaluation_only","external_distribution":"prohibited_pending_O009","authorization_basis":"user_explicit_local_training_mandate_2026-08-20","legal_review":"not_performed"},
    {"path":"examples/play-prod-v2/properties/general/stagioni_da_taggare.metis","blob_oid":"79376b188f9bcd6ec3e1b1f2231e6e118279bb68","sensitivity":"internal","use_scope":"local_training_and_evaluation_only","external_distribution":"prohibited_pending_O009","authorization_basis":"user_explicit_local_training_mandate_2026-08-20","legal_review":"not_performed"},
    {"path":"examples/play-prod-v2/properties/general/test_endpoint.metis","blob_oid":"4460273f49513d1cab0c32992cebcb9d64d85eb7","sensitivity":"internal","use_scope":"local_training_and_evaluation_only","external_distribution":"prohibited_pending_O009","authorization_basis":"user_explicit_local_training_mandate_2026-08-20","legal_review":"not_performed"},
    {"path":"examples/play-prod-v2/properties/play/_property.metis","blob_oid":"f04b8fc2cdeb13e75341b559d41cbd6aad92a338","sensitivity":"internal","use_scope":"local_training_and_evaluation_only","external_distribution":"prohibited_pending_O009","authorization_basis":"user_explicit_local_training_mandate_2026-08-20","legal_review":"not_performed"},
    {"path":"examples/play-prod-v2/properties/play/a_btest_cinema_free.metis","blob_oid":"3c0e2958f17d2a32430e77eba120b01db762c9b6","sensitivity":"internal","use_scope":"local_training_and_evaluation_only","external_distribution":"prohibited_pending_O009","authorization_basis":"user_explicit_local_training_mandate_2026-08-20","legal_review":"not_performed"},
    {"path":"examples/play-prod-v2/properties/play/article_season_params.metis","blob_oid":"c197b139be9b7023137a3b5234acbdc905547d9e","sensitivity":"internal","use_scope":"local_training_and_evaluation_only","external_distribution":"prohibited_pending_O009","authorization_basis":"user_explicit_local_training_mandate_2026-08-20","legal_review":"not_performed"},
    {"path":"examples/play-prod-v2/properties/play/because_you_fiction_serie_tv.metis","blob_oid":"5c468082aef07e0140ef6527642d71fbf3b2fef2","sensitivity":"internal","use_scope":"local_training_and_evaluation_only","external_distribution":"prohibited_pending_O009","authorization_basis":"user_explicit_local_training_mandate_2026-08-20","legal_review":"not_performed"},
    {"path":"examples/play-prod-v2/properties/play/chnls_all_movie_serie.metis","blob_oid":"03ffde13e04ec01f2ef9e380d472f4a8dc11d861","sensitivity":"internal","use_scope":"local_training_and_evaluation_only","external_distribution":"prohibited_pending_O009","authorization_basis":"user_explicit_local_training_mandate_2026-08-20","legal_review":"not_performed"},